<?xml version="1.0" encoding="UTF-8"?>

<!--
    Document   : MedicineSchema2.xml
    Created on : June 4, 2013, 4:16 PM
    Author     : Alina_Shumel
    Description:
        Purpose of the document follows.
-->

<ns0:Medicine  xmlns:xsi='http://www.w3.org/2001/XMLSchema-instance'
               xmlns:ns0='http://xml.netbeans.org/schema/MedicineSchema'
               xsi:schemaLocation='http://xml.netbeans.org/schema/MedicineSchema MedicineSchema.xsd'>
    <ns0:Medication>
        <ns0:Name>Азитромицин</ns0:Name>
        <ns0:Pharm>РБ</ns0:Pharm>
        <ns0:Group>антибиотики</ns0:Group>
        <ns0:Analog>хрень [htym2 [htym3</ns0:Analog>
        <ns0:Version>
            <ns0:Type>таблетки</ns0:Type>
            <ns0:Producer>
                <ns0:Certificate>
                    <ns0:ID>A001</ns0:ID>
                    <ns0:DateOfIssue>2001-12-12</ns0:DateOfIssue>
                    <ns0:DateOfExpiry>2015-01-12</ns0:DateOfExpiry>
                    <ns0:Authority>Не знаю</ns0:Authority>
                </ns0:Certificate>
                <ns0:Package>
                    <ns0:Type>блистер</ns0:Type>
                    <ns0:Count>10</ns0:Count>
                    <ns0:Prise>3000</ns0:Prise>
                    <ns0:CountInPack>1</ns0:CountInPack>
                </ns0:Package>
                <ns0:Dosage>
                    <ns0:Dose>0.04</ns0:Dose>
                    <ns0:Reception>каждые 6 часов</ns0:Reception>
                </ns0:Dosage>
            </ns0:Producer>
        </ns0:Version>
    </ns0:Medication>

</ns0:Medicine>
